title,url,changeNum,rangeNum,tradeIndex,tradeGrowth,payConverIndex
太空玩具沙子套装魔力安全无毒儿童女孩橡皮彩泥动力散沙彩沙粘土,//detail.tmall.com/item.htm?id=576007407702,持平,1,"31,048",-69.90%,866
超轻粘土24色儿童无毒橡皮泥彩泥太空水晶黏土女孩手工沙玩具套装,//detail.tmall.com/item.htm?id=14574686274,持平,2,"30,627",+4.51%,"1,208"
奥宇太空儿童沙子套装玩具魔力安全无毒男孩女孩粘土橡皮泥土批发,//detail.tmall.com/item.htm?id=525463670474,持平,3,"29,863",+12.49%,"1,100"
儿童太空玩具沙套装男孩女孩安全无毒魔力动力橡皮彩泥彩沙沙子泥,//detail.tmall.com/item.htm?id=525264665757,升1名,4,"27,276",+6.13%,815
儿童太空玩具沙子套装男孩女孩安全无毒魔力动力粘土沙橡皮泥彩泥,//detail.tmall.com/item.htm?id=554947414425,升1名,5,"25,390",-5.03%,928
超轻粘土24色橡皮泥无毒水晶彩泥儿童手工软陶泥太空黏土女孩套装,//detail.tmall.com/item.htm?id=43929357768,升1名,6,"24,201",-12.57%,"1,306"
超轻粘土24色36色橡皮泥无毒彩泥手工黏土大包装女孩太空儿童玩具,//detail.tmall.com/item.htm?id=44000798451,降3名,7,"23,046",-23.36%,946
卡乐优橡皮泥无毒彩泥儿童黏土大包装太空手工泥玩具套装超轻粘土,//detail.tmall.com/item.htm?id=534381476349,升1名,8,"18,390",-23.22%,881
超轻粘土36色橡皮泥无毒彩泥太空泥女孩手工水晶黏土24色儿童套装,//detail.tmall.com/item.htm?id=45070487089,升6名,9,"18,210",+34.30%,"1,158"
史莱姆材料包套装硼砂水水晶泥少女制作全套便宜做泥的材料起泡胶,//item.taobao.com/item.htm?id=571830851349,持平,10,"17,087",-9.51%,685
超轻粘土24色水晶手工橡皮泥无毒彩泥儿童太空黏土沙女孩套装玩具,//detail.tmall.com/item.htm?id=539420097663,升1名,11,"16,073",-14.35%,692
超轻粘土24色橡皮泥无毒水晶彩泥儿童手工泥太空黏土女孩套装玩具,//detail.tmall.com/item.htm?id=44737081342,降1名,12,"15,606",-21.28%,"1,136"
超轻粘土36色橡皮泥无毒水晶彩泥儿童手工黏土套装24色男女孩玩具,//detail.tmall.com/item.htm?id=568764929779,升4名,13,"15,585",+26.10%,917
水晶泥儿童史莱姆韩国无毒鼻涕橡皮粘土安全彩泥透明材料女孩玩具,//detail.tmall.com/item.htm?id=567253166232,降1名,14,"15,512",-13.63%,922
元派超轻粘土儿童手工diy黏土24色套装安全无毒太空橡皮彩泥玩具,//detail.tmall.com/item.htm?id=573082493832,升6名,15,"14,608",+31.59%,823
太空泥超轻粘土橡皮泥彩泥玩具24色12色无毒儿童女孩手工diy制作,//detail.tmall.com/item.htm?id=553369392840,升10名,16,"14,449",+49.12%,"1,655"
史莱姆材料包套装做泥的材料水晶泥硼砂水少女液态玻璃起泡胶全套,//item.taobao.com/item.htm?id=584782816339,降3名,17,"14,228",-13.86%,658
太空玩具沙套装安全无毒女孩男孩粘土泥儿童黏土魔力动力彩泥沙子,//detail.tmall.com/item.htm?id=580717782982,升2名,18,"13,246",+6.38%,876
新品24色超轻粘土100克500克套装橡皮泥3d彩泥大包装太空泥纸黏土,//item.taobao.com/item.htm?id=573200553191,-,19,"12,492","+15,802.14%",400
儿童太空玩具沙子套装男孩女孩安全无毒魔力动力粘土沙橡皮泥彩泥,//detail.tmall.com/item.htm?id=521274079054,升5名,20,"12,010",+6.60%,851
